{
  "runId": "golden-products-page",
  "workflowType": "PAGE",
  "status": "complete",
  "gates": {
    "G0_docsPass": "pass",
    "G1_compositionApproved": "pass",
    "G2_implementation": "pass",
    "G3_a11yTheme": "pass",
    "G4_quality": "pass",
    "G5_review": "pass",
    "G6_contractSync": "n/a"
  },
  "agents": {
    "discovery": "pass",
    "architect": "pass",
    "implementer": "pass",
    "reviewer": "pass"
  },
  "blockers": [],
  "outputs": {
    "route": "/playground/products",
    "implementationPath": "projects/docs/src/app/pages/playground/products-playground/"
  }
}
